{
  "$schema": "https://json-schema.org/draft/2020-12/schema",
  "title": "Round spec",
  "description": "One unit of delegated work, written before an office starts and frozen when it starts.",
  "type": "object",
  "additionalProperties": false,
  "required": ["id", "purpose", "inputs", "module_range", "languages", "gates", "acceptance", "frozen_at"],
  "properties": {
    "id": {"type": "string", "pattern": "^[a-z0-9][a-z0-9-]*$", "description": "Round id, also the file name."},
    "purpose": {"type": "string", "minLength": 1, "description": "One sentence, current-product wording."},
    "office": {"enum": ["office-author", "office-fix", "office-framework", "office-review"]},
    "inputs": {
      "type": "object",
      "minProperties": 1,
      "description": "One entry per repository the round reads; the exact commit the office starts from.",
      "additionalProperties": {
        "type": "object",
        "additionalProperties": false,
        "required": ["commit"],
        "properties": {
          "path": {"type": "string", "description": "Repository or worktree folder, relative to the parent folder of the course repository, or a placeholder."},
          "commit": {"type": "string", "pattern": "^[0-9a-f]{40}$", "description": "Full commit id the branch is cut from."}
        }
      }
    },
    "module_range": {
      "type": "object",
      "additionalProperties": false,
      "required": ["from", "to"],
      "properties": {
        "from": {"type": "integer", "minimum": 1},
        "to": {"type": "integer", "minimum": 1},
        "modules_regex": {"type": "string", "description": "The regex the gate passes to the tools, for example ^(4[1-5])-."}
      }
    },
    "languages": {
      "type": "array", "minItems": 1, "uniqueItems": true,
      "items": {"enum": ["python", "typescript", "java", "kotlin"]}
    },
    "gates": {
      "type": "array", "minItems": 1,
      "items": {"type": "string", "description": "A gate command, run from the worktree root."}
    },
    "acceptance": {
      "type": "object",
      "additionalProperties": {"type": "integer", "minimum": 0},
      "minProperties": 1,
      "description": "Numbers the hand-back must meet, for example modules, practices_per_language, plants_per_practice_min, quizzes."
    },
    "frozen_at": {"type": "string", "format": "date-time", "description": "UTC time the office started; inputs and scope change only by a new round."}
  }
}
