{
  "id": "cloud-readthrough-l1",
  "purpose": "Read-through of Level 1 (Foundations, modules 01 to 11): fix wording, accuracy and quiz defects in the lesson pages.",
  "office": "office-fix",
  "inputs": {
    "course": {
      "path": "claude-certification-preparation",
      "commit": "74f48c49c95be21692a0ed56e2123a5c33b4b35f"
    }
  },
  "module_range": {
    "from": 1,
    "to": 11,
    "modules_regex": "^(0[1-9]|1[01])-"
  },
  "languages": [
    "python",
    "typescript",
    "java",
    "kotlin"
  ],
  "gates": [
    "python3 tools/check_quiz.py",
    "python3 tools/test_check_quiz.py",
    "python3 tools/check_revision.py",
    "python3 tools/check_coverage.py",
    "python3 tools/check_logger.py --modules '.*'",
    "python3 tools/check_personal_data.py --modules '.*'"
  ],
  "acceptance": {
    "check_findings": 0,
    "files_outside_scope": 0
  },
  "frozen_at": "2026-10-05T14:00:00Z"
}
