{
  "id": "cloud-r2-l3",
  "purpose": "Level 3 second pass: verify product claims against official documentation, fix lesson sentences together with the mock items that quote them, and rework the weak quiz items.",
  "office": "office-fix",
  "inputs": {
    "course": {
      "path": "claude-certification-preparation",
      "commit": "6409c86398347d5a341118d272d0367e2fcc898d"
    }
  },
  "module_range": {
    "from": 45,
    "to": 78,
    "modules_regex": "^(4[5-9]|[56][0-9]|7[0-8])-"
  },
  "languages": [
    "python",
    "typescript",
    "java",
    "kotlin"
  ],
  "gates": [
    "python3 tools/check_quiz.py",
    "python3 tools/test_check_quiz.py",
    "python3 tools/check_revision.py",
    "python3 tools/check_coverage.py",
    "python3 tools/check_personal_data.py --modules '.*'"
  ],
  "acceptance": {
    "check_findings": 0,
    "files_outside_scope": 0
  },
  "frozen_at": "2026-10-05T18:00:00Z"
}
